{"$schema":"https://json-schema.org/draft/2020-12/schema","$id":"https://contextualwisdomlab.github.io/schemas/cwl-service-capability-v1.schema.json","title":"CWL Service Capability v1","description":"One repository-owned ContextualWisdomLab product responsibility boundary.","type":"object","additionalProperties":false,"required":["schema_version","service_id","repository","product_boundary","integration_mode","maturity","authority_domains","consumer_repositories","contracts","database_ownership","data_classifications","released_artifacts","next_actions"],"properties":{"schema_version":{"const":"1.0.0"},"service_id":{"type":"string","pattern":"^[a-z][a-z0-9]*(?:_[a-z0-9]+)+$","maxLength":128},"repository":{"type":"string","pattern":"^ContextualWisdomLab/[A-Za-z0-9_.-]+$","maxLength":128},"product_boundary":{"type":"string","minLength":1,"maxLength":2048},"integration_mode":{"type":"string","enum":["in_process_package","independent_service","offline_scientific_worker","build_operations_tool"]},"maturity":{"type":"string","enum":["planned","accepted_architecture","active_pr","implemented_on_protected_main","released","deprecated","superseded"]},"authority_domains":{"type":"array","minItems":1,"maxItems":128,"uniqueItems":true,"items":{"type":"string","pattern":"^[a-z][a-z0-9]*(?:_[a-z0-9]+)+$","maxLength":128}},"consumer_repositories":{"type":"array","maxItems":256,"uniqueItems":true,"items":{"type":"string","pattern":"^ContextualWisdomLab/[A-Za-z0-9_.-]+$","maxLength":128}},"contracts":{"type":"array","minItems":1,"maxItems":128,"items":{"$ref":"#/$defs/contract"}},"database_ownership":{"$ref":"#/$defs/database_ownership"},"data_classifications":{"type":"array","minItems":1,"maxItems":32,"uniqueItems":true,"items":{"type":"string","enum":["public","internal","confidential","restricted_identity","restricted_hr","security_metadata","no_business_data"]}},"released_artifacts":{"type":"array","maxItems":128,"items":{"$ref":"#/$defs/artifact"}},"next_actions":{"$ref":"#/$defs/next_actions"}},"$defs":{"contract":{"type":"object","additionalProperties":false,"required":["contract_id","contract_kind","contract_version","immutable_reference","direction","maturity"],"properties":{"contract_id":{"type":"string","pattern":"^[a-z][a-z0-9]*(?:_[a-z0-9]+)+$","maxLength":128},"contract_kind":{"type":"string","enum":["openapi","asyncapi_event","package","artifact_handoff","scientific_job","build_control","oauth_oidc","database_migration","schema_contract"]},"contract_version":{"type":"string","pattern":"^[1-9][0-9]*\\.[0-9]+\\.[0-9]+$","maxLength":32},"immutable_reference":{"type":"string","minLength":8,"maxLength":512,"pattern":"(?:@[1-9][0-9]*\\.[0-9]+\\.[0-9]+(?:$|[#:/])|(?:@|/commit/)[0-9a-f]{40}(?:$|[#:/])|@sha256:[0-9a-f]{64}(?:$|[#:/]))"},"direction":{"type":"string","enum":["provider_to_consumer","consumer_to_provider","bidirectional","offline_import"]},"maturity":{"type":"string","enum":["planned","accepted_architecture","active_pr","implemented_on_protected_main","released","deprecated","superseded"]}}},"database_ownership":{"type":"object","additionalProperties":false,"required":["owns_durable_state","authoritative_service_id","owned_database_objects","direct_cross_repository_sql"],"properties":{"owns_durable_state":{"type":"boolean"},"authoritative_service_id":{"type":"string","pattern":"^[a-z][a-z0-9]*(?:_[a-z0-9]+)+$","maxLength":128},"owned_database_objects":{"type":"array","uniqueItems":true,"maxItems":256,"items":{"type":"string","pattern":"^[a-z][a-z0-9]*(?:_[a-z0-9]+)+$","maxLength":128}},"direct_cross_repository_sql":{"const":false}}},"artifact":{"type":"object","additionalProperties":false,"required":["artifact_id","artifact_kind","artifact_version","immutable_reference","maturity"],"properties":{"artifact_id":{"type":"string","pattern":"^[a-z][a-z0-9]*(?:_[a-z0-9]+)+$","maxLength":128},"artifact_kind":{"type":"string","enum":["python_wheel","npm_package","oci_image","json_schema","openapi_document","asyncapi_document","sbom","data_artifact"]},"artifact_version":{"type":"string","pattern":"^[1-9][0-9]*\\.[0-9]+\\.[0-9]+$","maxLength":32},"immutable_reference":{"type":"string","minLength":8,"maxLength":512,"pattern":"(?:@[1-9][0-9]*\\.[0-9]+\\.[0-9]+(?:$|[#:/])|(?:@|/commit/)[0-9a-f]{40}(?:$|[#:/])|@sha256:[0-9a-f]{64}(?:$|[#:/]))"},"maturity":{"type":"string","enum":["planned","accepted_architecture","active_pr","implemented_on_protected_main","released","deprecated","superseded"]}}},"next_actions":{"type":"object","additionalProperties":false,"required":["success","rejection","timeout","duplicate","rollback"],"properties":{"success":{"type":"string","minLength":1,"maxLength":1024},"rejection":{"type":"string","minLength":1,"maxLength":1024},"timeout":{"type":"string","minLength":1,"maxLength":1024},"duplicate":{"type":"string","minLength":1,"maxLength":1024},"rollback":{"type":"string","minLength":1,"maxLength":1024}}}}}
