{"schema_version":"1.0.0","service_id":"mlsirm_compute","repository":"ContextualWisdomLab/fast-mlsirm","product_boundary":"Rust-first MLSIRM scientific computation and validation artifacts.","integration_mode":"offline_scientific_worker","maturity":"accepted_architecture","authority_domains":["model_fit"],"consumer_repositories":[],"contracts":[{"contract_id":"mlsirm_compute_contract","contract_kind":"scientific_job","contract_version":"1.0.0","immutable_reference":"contract:cwl/mlsirm_compute@1.0.0","direction":"provider_to_consumer","maturity":"accepted_architecture"}],"database_ownership":{"owns_durable_state":false,"authoritative_service_id":"mlsirm_compute","owned_database_objects":[],"direct_cross_repository_sql":false},"data_classifications":["confidential"],"released_artifacts":[],"next_actions":{"success":"Continue with the verified result.","rejection":"Preserve authoritative state and show the rejected requirement.","timeout":"Retry within the bounded budget or escalate.","duplicate":"Return the prior idempotent result.","rollback":"Restore the last verified contract or projection."}}
