{"schema_version":"1.0.0","service_id":"mhtml_ingestion","repository":"ContextualWisdomLab/mhtml-etl-gateway","product_boundary":"Governed MHTML parsing, schema proposal, validation, and row lineage.","integration_mode":"independent_service","maturity":"implemented_on_protected_main","authority_domains":["import_record"],"consumer_repositories":[],"contracts":[{"contract_id":"mhtml_ingestion_contract","contract_kind":"database_migration","contract_version":"1.0.0","immutable_reference":"contract:cwl/mhtml_ingestion@1.0.0","direction":"provider_to_consumer","maturity":"implemented_on_protected_main"}],"database_ownership":{"owns_durable_state":true,"authoritative_service_id":"mhtml_ingestion","owned_database_objects":["mhtml_ingestion_record"],"direct_cross_repository_sql":false},"data_classifications":["confidential"],"released_artifacts":[],"next_actions":{"success":"Continue with the verified result.","rejection":"Preserve authoritative state and show the rejected requirement.","timeout":"Retry within the bounded budget or escalate.","duplicate":"Return the prior idempotent result.","rollback":"Restore the last verified contract or projection."}}
