{"schema_version":"1.0.0","service_id":"document_authoring","repository":"ContextualWisdomLab/inkspan","product_boundary":"Host-owned structured authoring and deterministic document artifacts.","integration_mode":"in_process_package","maturity":"accepted_architecture","authority_domains":["document_revision"],"consumer_repositories":[],"contracts":[{"contract_id":"document_authoring_contract","contract_kind":"package","contract_version":"1.0.0","immutable_reference":"contract:cwl/document_authoring@1.0.0","direction":"provider_to_consumer","maturity":"accepted_architecture"}],"database_ownership":{"owns_durable_state":false,"authoritative_service_id":"document_authoring","owned_database_objects":[],"direct_cross_repository_sql":false},"data_classifications":["confidential"],"released_artifacts":[],"next_actions":{"success":"Continue with the verified result.","rejection":"Preserve authoritative state and show the rejected requirement.","timeout":"Retry within the bounded budget or escalate.","duplicate":"Return the prior idempotent result.","rollback":"Restore the last verified contract or projection."}}
