{"schema_version":"1.0.0","service_id":"organization_governance","repository":"ContextualWisdomLab/.github","product_boundary":"Organization engineering governance and reusable integration contracts.","integration_mode":"build_operations_tool","maturity":"implemented_on_protected_main","authority_domains":["integration_contract"],"consumer_repositories":["ContextualWisdomLab/Orgmetra"],"contracts":[{"contract_id":"organization_governance_contract","contract_kind":"build_control","contract_version":"1.0.0","immutable_reference":"contract:cwl/organization_governance@1.0.0","direction":"provider_to_consumer","maturity":"implemented_on_protected_main"}],"database_ownership":{"owns_durable_state":false,"authoritative_service_id":"organization_governance","owned_database_objects":[],"direct_cross_repository_sql":false},"data_classifications":["no_business_data"],"released_artifacts":[],"next_actions":{"success":"Continue with the verified result.","rejection":"Preserve authoritative state and show the rejected requirement.","timeout":"Retry within the bounded budget or escalate.","duplicate":"Return the prior idempotent result.","rollback":"Restore the last verified contract or projection."}}
