{"schema_version":"1.0.0","service_id":"psychometrics_operations","repository":"ContextualWisdomLab/psychometrics-commons","product_boundary":"Assessment publication, sessions, responses, consent, scoring dispatch, and immutable result snapshots.","integration_mode":"independent_service","maturity":"accepted_architecture","authority_domains":["assessment_session"],"consumer_repositories":[],"contracts":[{"contract_id":"psychometrics_operations_contract","contract_kind":"asyncapi_event","contract_version":"1.0.0","immutable_reference":"contract:cwl/psychometrics_operations@1.0.0","direction":"provider_to_consumer","maturity":"accepted_architecture"}],"database_ownership":{"owns_durable_state":true,"authoritative_service_id":"psychometrics_operations","owned_database_objects":["psychometrics_operations_record"],"direct_cross_repository_sql":false},"data_classifications":["restricted_hr"],"released_artifacts":[],"next_actions":{"success":"Continue with the verified result.","rejection":"Preserve authoritative state and show the rejected requirement.","timeout":"Retry within the bounded budget or escalate.","duplicate":"Return the prior idempotent result.","rollback":"Restore the last verified contract or projection."}}
