{"schema_version":"1.0.0","service_id":"rehearsal_analysis","repository":"ContextualWisdomLab/bandscope","product_boundary":"Local-first rehearsal analysis and explicit handoff artifacts.","integration_mode":"independent_service","maturity":"accepted_architecture","authority_domains":["rehearsal_result"],"consumer_repositories":[],"contracts":[{"contract_id":"rehearsal_analysis_contract","contract_kind":"artifact_handoff","contract_version":"1.0.0","immutable_reference":"contract:cwl/rehearsal_analysis@1.0.0","direction":"provider_to_consumer","maturity":"accepted_architecture"}],"database_ownership":{"owns_durable_state":true,"authoritative_service_id":"rehearsal_analysis","owned_database_objects":["rehearsal_analysis_record"],"direct_cross_repository_sql":false},"data_classifications":["confidential"],"released_artifacts":[],"next_actions":{"success":"Continue with the verified result.","rejection":"Preserve authoritative state and show the rejected requirement.","timeout":"Retry within the bounded budget or escalate.","duplicate":"Return the prior idempotent result.","rollback":"Restore the last verified contract or projection."}}
