{"schema_version":"1.0.0","service_id":"change_data_capture","repository":"ContextualWisdomLab/mightyETL","product_boundary":"Bounded ETL and PostgreSQL change-data-capture artifacts.","integration_mode":"independent_service","maturity":"accepted_architecture","authority_domains":["change_record"],"consumer_repositories":[],"contracts":[{"contract_id":"change_data_capture_contract","contract_kind":"database_migration","contract_version":"1.0.0","immutable_reference":"contract:cwl/change_data_capture@1.0.0","direction":"provider_to_consumer","maturity":"accepted_architecture"}],"database_ownership":{"owns_durable_state":true,"authoritative_service_id":"change_data_capture","owned_database_objects":["change_data_capture_record"],"direct_cross_repository_sql":false},"data_classifications":["confidential"],"released_artifacts":[],"next_actions":{"success":"Continue with the verified result.","rejection":"Preserve authoritative state and show the rejected requirement.","timeout":"Retry within the bounded budget or escalate.","duplicate":"Return the prior idempotent result.","rollback":"Restore the last verified contract or projection."}}
