{"schema_version":"1.0.0","service_id":"temporal_psychometrics","repository":"ContextualWisdomLab/TEPP","product_boundary":"Temporal event psychometric analysis with multilevel and multiple-membership evidence.","integration_mode":"offline_scientific_worker","maturity":"accepted_architecture","authority_domains":["temporal_event"],"consumer_repositories":[],"contracts":[{"contract_id":"temporal_psychometrics_contract","contract_kind":"scientific_job","contract_version":"1.0.0","immutable_reference":"contract:cwl/temporal_psychometrics@1.0.0","direction":"provider_to_consumer","maturity":"accepted_architecture"}],"database_ownership":{"owns_durable_state":false,"authoritative_service_id":"temporal_psychometrics","owned_database_objects":[],"direct_cross_repository_sql":false},"data_classifications":["restricted_hr"],"released_artifacts":[],"next_actions":{"success":"Continue with the verified result.","rejection":"Preserve authoritative state and show the rejected requirement.","timeout":"Retry within the bounded budget or escalate.","duplicate":"Return the prior idempotent result.","rollback":"Restore the last verified contract or projection."}}
