{"schema_version":"1.0.0","service_id":"egress_policy","repository":"ContextualWisdomLab/EgressWeave","product_boundary":"Provider-neutral outbound HTTP control with SSRF and DNS-rebinding defenses, redirect isolation, exact authority policy, and immutable release/SBOM evidence.","integration_mode":"in_process_package","maturity":"implemented_on_protected_main","authority_domains":["egress_decision","release_evidence","ssrf_dns_control"],"consumer_repositories":[],"contracts":[{"contract_id":"egress_policy_contract","contract_kind":"package","contract_version":"1.0.0","immutable_reference":"contract:cwl/egress_policy@1.0.0","direction":"provider_to_consumer","maturity":"implemented_on_protected_main"}],"database_ownership":{"owns_durable_state":false,"authoritative_service_id":"egress_policy","owned_database_objects":[],"direct_cross_repository_sql":false},"data_classifications":["security_metadata"],"released_artifacts":[],"next_actions":{"success":"Continue with the verified result.","rejection":"Preserve authoritative state and show the rejected requirement.","timeout":"Retry within the bounded budget or escalate.","duplicate":"Return the prior idempotent result.","rollback":"Restore the last verified contract or projection."}}
