{"schema_version":"1.0.0","service_id":"orgmetra_hris","repository":"ContextualWisdomLab/Orgmetra","product_boundary":"Authoritative people, employment, organization, job, position, assignment, performance, and decision records.","integration_mode":"independent_service","maturity":"active_pr","authority_domains":["employment_fact"],"consumer_repositories":[],"contracts":[{"contract_id":"orgmetra_hris_contract","contract_kind":"openapi","contract_version":"1.0.0","immutable_reference":"contract:cwl/orgmetra_hris@1.0.0","direction":"provider_to_consumer","maturity":"active_pr"}],"database_ownership":{"owns_durable_state":true,"authoritative_service_id":"orgmetra_hris","owned_database_objects":["orgmetra_hris_record"],"direct_cross_repository_sql":false},"data_classifications":["restricted_hr"],"released_artifacts":[],"next_actions":{"success":"Continue with the verified result.","rejection":"Preserve authoritative state and show the rejected requirement.","timeout":"Retry within the bounded budget or escalate.","duplicate":"Return the prior idempotent result.","rollback":"Restore the last verified contract or projection."}}
