{"schema_version":"1.0.0","service_id":"embedding_continuity","repository":"ContextualWisdomLab/EmbedRelay","product_boundary":"Embedding-space registry, fidelity-bounded adapters, dual-index migration, and native backfill.","integration_mode":"independent_service","maturity":"accepted_architecture","authority_domains":["embedding_space"],"consumer_repositories":[],"contracts":[{"contract_id":"embedding_continuity_contract","contract_kind":"openapi","contract_version":"1.0.0","immutable_reference":"contract:cwl/embedding_continuity@1.0.0","direction":"provider_to_consumer","maturity":"accepted_architecture"}],"database_ownership":{"owns_durable_state":true,"authoritative_service_id":"embedding_continuity","owned_database_objects":["embedding_continuity_record"],"direct_cross_repository_sql":false},"data_classifications":["confidential"],"released_artifacts":[],"next_actions":{"success":"Continue with the verified result.","rejection":"Preserve authoritative state and show the rejected requirement.","timeout":"Retry within the bounded budget or escalate.","duplicate":"Return the prior idempotent result.","rollback":"Restore the last verified contract or projection."}}
