{"schema_version":"1.0.0","service_id":"communication_control","repository":"ContextualWisdomLab/naruon","product_boundary":"Customer-owned mail, calendar, and file interaction control plane.","integration_mode":"independent_service","maturity":"accepted_architecture","authority_domains":["communication_intent"],"consumer_repositories":[],"contracts":[{"contract_id":"communication_control_contract","contract_kind":"asyncapi_event","contract_version":"1.0.0","immutable_reference":"contract:cwl/communication_control@1.0.0","direction":"provider_to_consumer","maturity":"accepted_architecture"}],"database_ownership":{"owns_durable_state":true,"authoritative_service_id":"communication_control","owned_database_objects":["communication_control_record"],"direct_cross_repository_sql":false},"data_classifications":["confidential"],"released_artifacts":[],"next_actions":{"success":"Continue with the verified result.","rejection":"Preserve authoritative state and show the rejected requirement.","timeout":"Retry within the bounded budget or escalate.","duplicate":"Return the prior idempotent result.","rollback":"Restore the last verified contract or projection."}}
