{"schema_version":"1.0.0","service_id":"security_operations","repository":"ContextualWisdomLab/wardnet","product_boundary":"WAF and IDS security-event ingestion, AI SOC response, monitor/block enforcement, bounded security-state persistence, and SIEM export contracts; full production engines and enterprise SIEM deployment remain explicit adapters.","integration_mode":"independent_service","maturity":"implemented_on_protected_main","authority_domains":["ai_soc_response","ids_event","siem_event","waf_control"],"consumer_repositories":[],"contracts":[{"contract_id":"security_operations_contract","contract_kind":"openapi","contract_version":"1.0.0","immutable_reference":"contract:cwl/security_operations@1.0.0","direction":"provider_to_consumer","maturity":"implemented_on_protected_main"}],"database_ownership":{"owns_durable_state":true,"authoritative_service_id":"security_operations","owned_database_objects":["security_event_record","threat_indicator_record"],"direct_cross_repository_sql":false},"data_classifications":["security_metadata"],"released_artifacts":[],"next_actions":{"success":"Continue with the verified result.","rejection":"Preserve authoritative state and show the rejected requirement.","timeout":"Retry within the bounded budget or escalate.","duplicate":"Return the prior idempotent result.","rollback":"Restore the last verified contract or projection."}}
