{"schema_version":"1.0.0","service_id":"semantic_catalog","repository":"ContextualWisdomLab/semantic-data-portal","product_boundary":"Ontology, taxonomy, and semantic data catalogue authority.","integration_mode":"independent_service","maturity":"accepted_architecture","authority_domains":["ontology_record"],"consumer_repositories":[],"contracts":[{"contract_id":"semantic_catalog_contract","contract_kind":"openapi","contract_version":"1.0.0","immutable_reference":"contract:cwl/semantic_catalog@1.0.0","direction":"provider_to_consumer","maturity":"accepted_architecture"}],"database_ownership":{"owns_durable_state":true,"authoritative_service_id":"semantic_catalog","owned_database_objects":["semantic_catalog_record"],"direct_cross_repository_sql":false},"data_classifications":["internal"],"released_artifacts":[],"next_actions":{"success":"Continue with the verified result.","rejection":"Preserve authoritative state and show the rejected requirement.","timeout":"Retry within the bounded budget or escalate.","duplicate":"Return the prior idempotent result.","rollback":"Restore the last verified contract or projection."}}
