{"schema_version":"1.0.0","service_id":"identity_federation","repository":"ContextualWisdomLab/keyverse","product_boundary":"Identity credentials, federation, OIDC, SCIM provisioning, passkeys, account lifecycle and unification, and opaque subject references.","integration_mode":"independent_service","maturity":"accepted_architecture","authority_domains":["account_lifecycle","identity_credential","scim_lifecycle"],"consumer_repositories":["ContextualWisdomLab/Orgmetra"],"contracts":[{"contract_id":"identity_federation_contract","contract_kind":"oauth_oidc","contract_version":"1.0.0","immutable_reference":"contract:cwl/identity_federation@1.0.0","direction":"provider_to_consumer","maturity":"accepted_architecture"}],"database_ownership":{"owns_durable_state":true,"authoritative_service_id":"identity_federation","owned_database_objects":["identity_federation_record"],"direct_cross_repository_sql":false},"data_classifications":["restricted_identity"],"released_artifacts":[],"next_actions":{"success":"Continue with the verified result.","rejection":"Preserve authoritative state and show the rejected requirement.","timeout":"Retry within the bounded budget or escalate.","duplicate":"Return the prior idempotent result.","rollback":"Restore the last verified contract or projection."}}
