{"schema_version":"1.0.0","service_id":"message_threading","repository":"ContextualWisdomLab/ThreadWeave","product_boundary":"Standards-based message thread construction and serialization.","integration_mode":"in_process_package","maturity":"implemented_on_protected_main","authority_domains":["thread_structure"],"consumer_repositories":[],"contracts":[{"contract_id":"message_threading_contract","contract_kind":"package","contract_version":"1.0.0","immutable_reference":"contract:cwl/message_threading@1.0.0","direction":"provider_to_consumer","maturity":"implemented_on_protected_main"}],"database_ownership":{"owns_durable_state":false,"authoritative_service_id":"message_threading","owned_database_objects":[],"direct_cross_repository_sql":false},"data_classifications":["confidential"],"released_artifacts":[],"next_actions":{"success":"Continue with the verified result.","rejection":"Preserve authoritative state and show the rejected requirement.","timeout":"Retry within the bounded budget or escalate.","duplicate":"Return the prior idempotent result.","rollback":"Restore the last verified contract or projection."}}
