{"schema_version":"1.0.0","service_id":"database_design","repository":"ContextualWisdomLab/pg-erd-cloud","product_boundary":"PostgreSQL reverse engineering, ERD review, schema diff, and DDL design evidence.","integration_mode":"independent_service","maturity":"accepted_architecture","authority_domains":["schema_snapshot"],"consumer_repositories":[],"contracts":[{"contract_id":"database_design_contract","contract_kind":"artifact_handoff","contract_version":"1.0.0","immutable_reference":"contract:cwl/database_design@1.0.0","direction":"provider_to_consumer","maturity":"accepted_architecture"}],"database_ownership":{"owns_durable_state":true,"authoritative_service_id":"database_design","owned_database_objects":["database_design_record"],"direct_cross_repository_sql":false},"data_classifications":["confidential"],"released_artifacts":[],"next_actions":{"success":"Continue with the verified result.","rejection":"Preserve authoritative state and show the rejected requirement.","timeout":"Retry within the bounded budget or escalate.","duplicate":"Return the prior idempotent result.","rollback":"Restore the last verified contract or projection."}}
