{"schema_version":"1.0.0","service_id":"personal_life_planning","repository":"ContextualWisdomLab/life-os","product_boundary":"User-owned goals, projects, habits, tasks, and reviews.","integration_mode":"independent_service","maturity":"accepted_architecture","authority_domains":["personal_goal"],"consumer_repositories":[],"contracts":[{"contract_id":"personal_life_planning_contract","contract_kind":"openapi","contract_version":"1.0.0","immutable_reference":"contract:cwl/personal_life_planning@1.0.0","direction":"provider_to_consumer","maturity":"accepted_architecture"}],"database_ownership":{"owns_durable_state":true,"authoritative_service_id":"personal_life_planning","owned_database_objects":["personal_life_planning_record"],"direct_cross_repository_sql":false},"data_classifications":["confidential"],"released_artifacts":[],"next_actions":{"success":"Continue with the verified result.","rejection":"Preserve authoritative state and show the rejected requirement.","timeout":"Retry within the bounded budget or escalate.","duplicate":"Return the prior idempotent result.","rollback":"Restore the last verified contract or projection."}}
