{"schema_version":"1.0.0","service_id":"document_dom","repository":"ContextualWisdomLab/newsdom-api","product_boundary":"Canonical document blocks, source spans, images, captions, and layout references.","integration_mode":"independent_service","maturity":"accepted_architecture","authority_domains":["document_block"],"consumer_repositories":[],"contracts":[{"contract_id":"document_dom_contract","contract_kind":"openapi","contract_version":"1.0.0","immutable_reference":"contract:cwl/document_dom@1.0.0","direction":"provider_to_consumer","maturity":"accepted_architecture"}],"database_ownership":{"owns_durable_state":true,"authoritative_service_id":"document_dom","owned_database_objects":["document_dom_record"],"direct_cross_repository_sql":false},"data_classifications":["confidential"],"released_artifacts":[],"next_actions":{"success":"Continue with the verified result.","rejection":"Preserve authoritative state and show the rejected requirement.","timeout":"Retry within the bounded budget or escalate.","duplicate":"Return the prior idempotent result.","rollback":"Restore the last verified contract or projection."}}
